{"authority":"advisory","edges":[{"attrs":{},"from":"n:module","id":"e:calls:assignTask:1703","kind":"Calls","symbol":"cp:Calls","to":"n:typeref:assignTask"},{"attrs":{},"from":"n:module","id":"e:calls:constructor:1472","kind":"Calls","symbol":"cp:Calls","to":"n:typeref:constructor"},{"attrs":{},"from":"n:module","id":"e:calls:destroy:2590","kind":"Calls","symbol":"cp:Calls","to":"n:typeref:destroy"},{"attrs":{},"from":"n:module","id":"e:calls:getActiveAgents:2427","kind":"Calls","symbol":"cp:Calls","to":"n:typeref:getActiveAgents"},{"attrs":{},"from":"n:module","id":"e:calls:getAgent:2334","kind":"Calls","symbol":"cp:Calls","to":"n:typeref:getAgent"},{"attrs":{},"from":"n:module","id":"e:calls:getAllAgents:2391","kind":"Calls","symbol":"cp:Calls","to":"n:typeref:getAllAgents"},{"attrs":{},"from":"n:module","id":"e:calls:getNetworkMetrics:2560","kind":"Calls","symbol":"cp:Calls","to":"n:typeref:getNetworkMetrics"},{"attrs":{},"from":"n:module","id":"e:calls:getPendingTasks:2524","kind":"Calls","symbol":"cp:Calls","to":"n:typeref:getPendingTasks"},{"attrs":{},"from":"n:module","id":"e:calls:getTaskStatus:2466","kind":"Calls","symbol":"cp:Calls","to":"n:typeref:getTaskStatus"},{"attrs":{},"from":"n:module","id":"e:calls:registerAgent:1610","kind":"Calls","symbol":"cp:Calls","to":"n:typeref:registerAgent"},{"attrs":{},"from":"n:module","id":"e:calls:requestConsensus:1901","kind":"Calls","symbol":"cp:Calls","to":"n:typeref:requestConsensus"},{"attrs":{},"from":"n:module","id":"e:calls:sendMessage:1846","kind":"Calls","symbol":"cp:Calls","to":"n:typeref:sendMessage"},{"attrs":{},"from":"n:module","id":"e:calls:unregisterAgent:1656","kind":"Calls","symbol":"cp:Calls","to":"n:typeref:unregisterAgent"},{"attrs":{},"from":"n:module","id":"e:imports:../consensus/index.js:132","kind":"Imports","symbol":"cp:Imports","to":"n:import:../consensus/index.js"},{"attrs":{},"from":"n:module","id":"e:imports:../mqtt/index.js:82","kind":"Imports","symbol":"cp:Imports","to":"n:import:../mqtt/index.js"},{"attrs":{},"from":"n:module","id":"e:imports:../p2p/index.js:39","kind":"Imports","symbol":"cp:Imports","to":"n:import:../p2p/index.js"},{"attrs":{},"from":"n:module","id":"e:imports:../visualization/index.js:200","kind":"Imports","symbol":"cp:Imports","to":"n:import:../visualization/index.js"},{"attrs":{},"from":"n:module","id":"e:imports:events:0","kind":"Imports","symbol":"cp:Imports","to":"n:import:events"}],"graph_hash":"sha256:165728b2199b7dddb01410df3471cc7eb67f1bfab5dcec9fce72e3373d518bb4","language":"typescript","namespace":"analysis.typescript.packages.universal-life-network.src.agents.index.d.ts","nodes":[{"attrs":{"name":"../consensus/index.js"},"id":"n:import:../consensus/index.js","kind":"Namespace","source":{"column":0,"end_column":67,"end_line":4,"line":4,"path":"packages/universal-life-network/src/agents/index.d.ts"},"symbol":"cp:Namespace"},{"attrs":{"name":"../mqtt/index.js"},"id":"n:import:../mqtt/index.js","kind":"Namespace","source":{"column":0,"end_column":49,"end_line":3,"line":3,"path":"packages/universal-life-network/src/agents/index.d.ts"},"symbol":"cp:Namespace"},{"attrs":{"name":"../p2p/index.js"},"id":"n:import:../p2p/index.js","kind":"Namespace","source":{"column":0,"end_column":42,"end_line":2,"line":2,"path":"packages/universal-life-network/src/agents/index.d.ts"},"symbol":"cp:Namespace"},{"attrs":{"name":"../visualization/index.js"},"id":"n:import:../visualization/index.js","kind":"Namespace","source":{"column":0,"end_column":62,"end_line":5,"line":5,"path":"packages/universal-life-network/src/agents/index.d.ts"},"symbol":"cp:Namespace"},{"attrs":{"name":"events"},"id":"n:import:events","kind":"Namespace","source":{"column":0,"end_column":38,"end_line":1,"line":1,"path":"packages/universal-life-network/src/agents/index.d.ts"},"symbol":"cp:Namespace"},{"attrs":{"name":"packages/universal-life-network/src/agents/index.d.ts"},"id":"n:module","kind":"Module","source":{"column":0,"end_column":34,"end_line":80,"line":1,"path":"packages/universal-life-network/src/agents/index.d.ts"},"symbol":"cp:Module"},{"attrs":{"name":"assignTask"},"id":"n:typeref:assignTask","kind":"TypeRef","source":{"column":4,"end_column":15,"end_line":55,"line":55,"path":"packages/universal-life-network/src/agents/index.d.ts"},"symbol":"cp:TypeRef"},{"attrs":{"name":"constructor"},"id":"n:typeref:constructor","kind":"TypeRef","source":{"column":4,"end_column":16,"end_line":52,"line":52,"path":"packages/universal-life-network/src/agents/index.d.ts"},"symbol":"cp:TypeRef"},{"attrs":{"name":"destroy"},"id":"n:typeref:destroy","kind":"TypeRef","source":{"column":4,"end_column":12,"end_line":77,"line":77,"path":"packages/universal-life-network/src/agents/index.d.ts"},"symbol":"cp:TypeRef"},{"attrs":{"name":"getActiveAgents"},"id":"n:typeref:getActiveAgents","kind":"TypeRef","source":{"column":4,"end_column":20,"end_line":73,"line":73,"path":"packages/universal-life-network/src/agents/index.d.ts"},"symbol":"cp:TypeRef"},{"attrs":{"name":"getAgent"},"id":"n:typeref:getAgent","kind":"TypeRef","source":{"column":4,"end_column":13,"end_line":71,"line":71,"path":"packages/universal-life-network/src/agents/index.d.ts"},"symbol":"cp:TypeRef"},{"attrs":{"name":"getAllAgents"},"id":"n:typeref:getAllAgents","kind":"TypeRef","source":{"column":4,"end_column":17,"end_line":72,"line":72,"path":"packages/universal-life-network/src/agents/index.d.ts"},"symbol":"cp:TypeRef"},{"attrs":{"name":"getNetworkMetrics"},"id":"n:typeref:getNetworkMetrics","kind":"TypeRef","source":{"column":4,"end_column":22,"end_line":76,"line":76,"path":"packages/universal-life-network/src/agents/index.d.ts"},"symbol":"cp:TypeRef"},{"attrs":{"name":"getPendingTasks"},"id":"n:typeref:getPendingTasks","kind":"TypeRef","source":{"column":4,"end_column":20,"end_line":75,"line":75,"path":"packages/universal-life-network/src/agents/index.d.ts"},"symbol":"cp:TypeRef"},{"attrs":{"name":"getTaskStatus"},"id":"n:typeref:getTaskStatus","kind":"TypeRef","source":{"column":4,"end_column":18,"end_line":74,"line":74,"path":"packages/universal-life-network/src/agents/index.d.ts"},"symbol":"cp:TypeRef"},{"attrs":{"name":"registerAgent"},"id":"n:typeref:registerAgent","kind":"TypeRef","source":{"column":4,"end_column":18,"end_line":53,"line":53,"path":"packages/universal-life-network/src/agents/index.d.ts"},"symbol":"cp:TypeRef"},{"attrs":{"name":"requestConsensus"},"id":"n:typeref:requestConsensus","kind":"TypeRef","source":{"column":4,"end_column":21,"end_line":59,"line":59,"path":"packages/universal-life-network/src/agents/index.d.ts"},"symbol":"cp:TypeRef"},{"attrs":{"name":"sendMessage"},"id":"n:typeref:sendMessage","kind":"TypeRef","source":{"column":4,"end_column":16,"end_line":58,"line":58,"path":"packages/universal-life-network/src/agents/index.d.ts"},"symbol":"cp:TypeRef"},{"attrs":{"name":"unregisterAgent"},"id":"n:typeref:unregisterAgent","kind":"TypeRef","source":{"column":4,"end_column":20,"end_line":54,"line":54,"path":"packages/universal-life-network/src/agents/index.d.ts"},"symbol":"cp:TypeRef"}],"provenance":{"parser":"typescript-regex","parser_version":"v0","source_path":"packages/universal-life-network/src/agents/index.d.ts"},"v":"ak.asg.v0"}
