{"authority":"advisory","edges":[{"attrs":{},"from":"n:module","id":"e:calls:AgentAPIClient:515","kind":"Calls","symbol":"cp:Calls","to":"n:typeref:AgentAPIClient"},{"attrs":{},"from":"n:module","id":"e:calls:MockAgentAPIClient:476","kind":"Calls","symbol":"cp:Calls","to":"n:typeref:MockAgentAPIClient"},{"attrs":{},"from":"n:module","id":"e:calls:createAgentAPIClient:380","kind":"Calls","symbol":"cp:Calls","to":"n:typeref:createAgentAPIClient"},{"attrs":{},"from":"n:module","id":"e:defines:function:createAgentAPIClient","kind":"Defines","symbol":"cp:Defines","to":"n:function:createAgentAPIClient"},{"attrs":{},"from":"n:module","id":"e:imports:./client:268","kind":"Imports","symbol":"cp:Imports","to":"n:import:./client"},{"attrs":{},"from":"n:module","id":"e:imports:./mock-client:311","kind":"Imports","symbol":"cp:Imports","to":"n:import:./mock-client"},{"attrs":{},"from":"n:module","id":"e:imports:./types:216","kind":"Imports","symbol":"cp:Imports","to":"n:import:./types"}],"graph_hash":"sha256:bdb5ae2715c08c42dcddfa903282c3116fed04cf853b967f16a584fcdc1d8ad7","language":"typescript","namespace":"analysis.typescript.ui.src.services.agent-api.index.ts","nodes":[{"attrs":{"name":"createAgentAPIClient"},"id":"n:function:createAgentAPIClient","kind":"Function","source":{"column":0,"end_column":37,"end_line":16,"line":15,"path":"ui/src/services/agent-api/index.ts"},"symbol":"cp:Function"},{"attrs":{"name":"./client"},"id":"n:import:./client","kind":"Namespace","source":{"column":0,"end_column":42,"end_line":13,"line":13,"path":"ui/src/services/agent-api/index.ts"},"symbol":"cp:Namespace"},{"attrs":{"name":"./mock-client"},"id":"n:import:./mock-client","kind":"Namespace","source":{"column":0,"end_column":51,"end_line":14,"line":14,"path":"ui/src/services/agent-api/index.ts"},"symbol":"cp:Namespace"},{"attrs":{"name":"./types"},"id":"n:import:./types","kind":"Namespace","source":{"column":0,"end_column":51,"end_line":12,"line":12,"path":"ui/src/services/agent-api/index.ts"},"symbol":"cp:Namespace"},{"attrs":{"name":"ui/src/services/agent-api/index.ts"},"id":"n:module","kind":"Module","source":{"column":0,"end_column":1,"end_line":21,"line":1,"path":"ui/src/services/agent-api/index.ts"},"symbol":"cp:Module"},{"attrs":{"name":"AgentAPIClient"},"id":"n:typeref:AgentAPIClient","kind":"TypeRef","source":{"column":13,"end_column":28,"end_line":20,"line":20,"path":"ui/src/services/agent-api/index.ts"},"symbol":"cp:TypeRef"},{"attrs":{"name":"MockAgentAPIClient"},"id":"n:typeref:MockAgentAPIClient","kind":"TypeRef","source":{"column":15,"end_column":34,"end_line":18,"line":18,"path":"ui/src/services/agent-api/index.ts"},"symbol":"cp:TypeRef"},{"attrs":{"name":"createAgentAPIClient"},"id":"n:typeref:createAgentAPIClient","kind":"TypeRef","source":{"column":16,"end_column":37,"end_line":16,"line":16,"path":"ui/src/services/agent-api/index.ts"},"symbol":"cp:TypeRef"}],"provenance":{"parser":"typescript-regex","parser_version":"v0","source_path":"ui/src/services/agent-api/index.ts"},"v":"ak.asg.v0"}
