{"authority":"advisory","edges":[{"attrs":{},"from":"n:module","id":"e:calls:IPCTransport:337","kind":"Calls","symbol":"cp:Calls","to":"n:typeref:IPCTransport"},{"attrs":{},"from":"n:module","id":"e:calls:afterEach:398","kind":"Calls","symbol":"cp:Calls","to":"n:typeref:afterEach"},{"attrs":{},"from":"n:module","id":"e:calls:beforeEach:272","kind":"Calls","symbol":"cp:Calls","to":"n:typeref:beforeEach"},{"attrs":{},"from":"n:module","id":"e:calls:describe:205","kind":"Calls","symbol":"cp:Calls","to":"n:typeref:describe"},{"attrs":{},"from":"n:module","id":"e:calls:describe:440","kind":"Calls","symbol":"cp:Calls","to":"n:typeref:describe"},{"attrs":{},"from":"n:module","id":"e:calls:expect:537","kind":"Calls","symbol":"cp:Calls","to":"n:typeref:expect"},{"attrs":{},"from":"n:module","id":"e:calls:test:479","kind":"Calls","symbol":"cp:Calls","to":"n:typeref:test"},{"attrs":{},"from":"n:module","id":"e:calls:toBeDefined:554","kind":"Calls","symbol":"cp:Calls","to":"n:typeref:toBeDefined"},{"attrs":{},"from":"n:module","id":"e:imports:../../core/transports/ipc-transport:135","kind":"Imports","symbol":"cp:Imports","to":"n:import:../../core/transports/ipc-transport"}],"graph_hash":"sha256:e207de4f65016b200405e10c228e19848414ce0201e3b173f9533142c7b95923","language":"typescript","namespace":"analysis.typescript.packages.hyperbolic-geometric-neural-network.src.tests.templates.ipc-transport.test.ts","nodes":[{"attrs":{"name":"../../core/transports/ipc-transport"},"id":"n:import:../../core/transports/ipc-transport","kind":"Namespace","source":{"column":0,"end_column":67,"end_line":10,"line":9,"path":"packages/hyperbolic-geometric-neural-network/src/tests/templates/ipc-transport.test.ts"},"symbol":"cp:Namespace"},{"attrs":{"name":"packages/hyperbolic-geometric-neural-network/src/tests/templates/ipc-transport.test.ts"},"id":"n:module","kind":"Module","source":{"column":0,"end_column":3,"end_line":32,"line":1,"path":"packages/hyperbolic-geometric-neural-network/src/tests/templates/ipc-transport.test.ts"},"symbol":"cp:Module"},{"attrs":{"name":"IPCTransport"},"id":"n:typeref:IPCTransport","kind":"TypeRef","source":{"column":19,"end_column":32,"end_line":17,"line":17,"path":"packages/hyperbolic-geometric-neural-network/src/tests/templates/ipc-transport.test.ts"},"symbol":"cp:TypeRef"},{"attrs":{"name":"afterEach"},"id":"n:typeref:afterEach","kind":"TypeRef","source":{"column":2,"end_column":12,"end_line":20,"line":20,"path":"packages/hyperbolic-geometric-neural-network/src/tests/templates/ipc-transport.test.ts"},"symbol":"cp:TypeRef"},{"attrs":{"name":"beforeEach"},"id":"n:typeref:beforeEach","kind":"TypeRef","source":{"column":2,"end_column":13,"end_line":15,"line":15,"path":"packages/hyperbolic-geometric-neural-network/src/tests/templates/ipc-transport.test.ts"},"symbol":"cp:TypeRef"},{"attrs":{"name":"describe"},"id":"n:typeref:describe","kind":"TypeRef","source":{"column":0,"end_column":9,"end_line":12,"line":12,"path":"packages/hyperbolic-geometric-neural-network/src/tests/templates/ipc-transport.test.ts"},"symbol":"cp:TypeRef"},{"attrs":{"name":"expect"},"id":"n:typeref:expect","kind":"TypeRef","source":{"column":6,"end_column":13,"end_line":26,"line":26,"path":"packages/hyperbolic-geometric-neural-network/src/tests/templates/ipc-transport.test.ts"},"symbol":"cp:TypeRef"},{"attrs":{"name":"test"},"id":"n:typeref:test","kind":"TypeRef","source":{"column":4,"end_column":9,"end_line":25,"line":25,"path":"packages/hyperbolic-geometric-neural-network/src/tests/templates/ipc-transport.test.ts"},"symbol":"cp:TypeRef"},{"attrs":{"name":"toBeDefined"},"id":"n:typeref:toBeDefined","kind":"TypeRef","source":{"column":23,"end_column":35,"end_line":26,"line":26,"path":"packages/hyperbolic-geometric-neural-network/src/tests/templates/ipc-transport.test.ts"},"symbol":"cp:TypeRef"}],"provenance":{"parser":"typescript-regex","parser_version":"v0","source_path":"packages/hyperbolic-geometric-neural-network/src/tests/templates/ipc-transport.test.ts"},"v":"ak.asg.v0"}
