{"authority":"advisory","edges":[{"attrs":{},"from":"n:function:main","id":"e:calls:main:Path:23:24","kind":"Calls","symbol":"cp:Calls","to":"n:typeref:Path"},{"attrs":{},"from":"n:function:main","id":"e:calls:main:argparse.ArgumentParser:19:11","kind":"Calls","symbol":"cp:Calls","to":"n:typeref:argparse.ArgumentParser"},{"attrs":{},"from":"n:function:main","id":"e:calls:main:expr.read_text:23:24","kind":"Calls","symbol":"cp:Calls","to":"n:typeref:expr.read_text"},{"attrs":{},"from":"n:function:main","id":"e:calls:main:json.loads:23:13","kind":"Calls","symbol":"cp:Calls","to":"n:typeref:json.loads"},{"attrs":{},"from":"n:function:main","id":"e:calls:main:parser.add_argument:20:2","kind":"Calls","symbol":"cp:Calls","to":"n:typeref:parser.add_argument"},{"attrs":{},"from":"n:function:main","id":"e:calls:main:parser.parse_args:21:9","kind":"Calls","symbol":"cp:Calls","to":"n:typeref:parser.parse_args"},{"attrs":{},"from":"n:function:main","id":"e:calls:main:print:25:2","kind":"Calls","symbol":"cp:Calls","to":"n:typeref:print"},{"attrs":{},"from":"n:function:main","id":"e:calls:main:validate_workspace_manifest:24:2","kind":"Calls","symbol":"cp:Calls","to":"n:typeref:validate_workspace_manifest"},{"attrs":{},"from":"n:module","id":"e:defines:function:main","kind":"Defines","symbol":"cp:Defines","to":"n:function:main"},{"attrs":{"level":0},"from":"n:module","id":"e:imports:__future__","kind":"Imports","symbol":"cp:Imports","to":"n:import:__future__"},{"attrs":{"alias":""},"from":"n:module","id":"e:imports:argparse","kind":"Imports","symbol":"cp:Imports","to":"n:import:argparse"},{"attrs":{"alias":""},"from":"n:module","id":"e:imports:json","kind":"Imports","symbol":"cp:Imports","to":"n:import:json"},{"attrs":{"level":0},"from":"n:module","id":"e:imports:pathlib","kind":"Imports","symbol":"cp:Imports","to":"n:import:pathlib"},{"attrs":{"level":0},"from":"n:module","id":"e:imports:runtime.atomic_kernel.workspace_ingest","kind":"Imports","symbol":"cp:Imports","to":"n:import:runtime.atomic_kernel.workspace_ingest"},{"attrs":{"alias":""},"from":"n:module","id":"e:imports:sys","kind":"Imports","symbol":"cp:Imports","to":"n:import:sys"}],"graph_hash":"sha256:080bbfe03d7a846568b25e1965f6b0b5c20081ffd53472d3387f7a66da9d2597","language":"python","namespace":"analysis.python.scripts.validate-workspace-manifest.py","nodes":[{"attrs":{"name":"main"},"id":"n:function:main","kind":"Function","source":{"column":0,"end_column":10,"end_line":26,"line":18,"path":"scripts/validate-workspace-manifest.py"},"symbol":"cp:Function"},{"attrs":{"name":"__future__"},"id":"n:import:__future__","kind":"Namespace","source":{"column":0,"end_column":34,"end_line":4,"line":4,"path":"scripts/validate-workspace-manifest.py"},"symbol":"cp:Namespace"},{"attrs":{"name":"argparse"},"id":"n:import:argparse","kind":"Namespace","source":{"column":0,"end_column":15,"end_line":6,"line":6,"path":"scripts/validate-workspace-manifest.py"},"symbol":"cp:Namespace"},{"attrs":{"name":"json"},"id":"n:import:json","kind":"Namespace","source":{"column":0,"end_column":11,"end_line":7,"line":7,"path":"scripts/validate-workspace-manifest.py"},"symbol":"cp:Namespace"},{"attrs":{"name":"pathlib"},"id":"n:import:pathlib","kind":"Namespace","source":{"column":0,"end_column":24,"end_line":9,"line":9,"path":"scripts/validate-workspace-manifest.py"},"symbol":"cp:Namespace"},{"attrs":{"name":"runtime.atomic_kernel.workspace_ingest"},"id":"n:import:runtime.atomic_kernel.workspace_ingest","kind":"Namespace","source":{"column":0,"end_column":78,"end_line":15,"line":15,"path":"scripts/validate-workspace-manifest.py"},"symbol":"cp:Namespace"},{"attrs":{"name":"sys"},"id":"n:import:sys","kind":"Namespace","source":{"column":0,"end_column":10,"end_line":8,"line":8,"path":"scripts/validate-workspace-manifest.py"},"symbol":"cp:Namespace"},{"attrs":{"name":"scripts/validate-workspace-manifest.py"},"id":"n:module","kind":"Module","source":{"column":0,"end_column":0,"end_line":1,"line":1,"path":"scripts/validate-workspace-manifest.py"},"symbol":"cp:Module"},{"attrs":{"name":"Path"},"id":"n:typeref:Path","kind":"TypeRef","source":{"column":24,"end_column":43,"end_line":23,"line":23,"path":"scripts/validate-workspace-manifest.py"},"symbol":"cp:TypeRef"},{"attrs":{"name":"argparse.ArgumentParser"},"id":"n:typeref:argparse.ArgumentParser","kind":"TypeRef","source":{"column":11,"end_column":55,"end_line":19,"line":19,"path":"scripts/validate-workspace-manifest.py"},"symbol":"cp:TypeRef"},{"attrs":{"name":"expr.read_text"},"id":"n:typeref:expr.read_text","kind":"TypeRef","source":{"column":24,"end_column":71,"end_line":23,"line":23,"path":"scripts/validate-workspace-manifest.py"},"symbol":"cp:TypeRef"},{"attrs":{"name":"json.loads"},"id":"n:typeref:json.loads","kind":"TypeRef","source":{"column":13,"end_column":72,"end_line":23,"line":23,"path":"scripts/validate-workspace-manifest.py"},"symbol":"cp:TypeRef"},{"attrs":{"name":"parser.add_argument"},"id":"n:typeref:parser.add_argument","kind":"TypeRef","source":{"column":2,"end_column":50,"end_line":20,"line":20,"path":"scripts/validate-workspace-manifest.py"},"symbol":"cp:TypeRef"},{"attrs":{"name":"parser.parse_args"},"id":"n:typeref:parser.parse_args","kind":"TypeRef","source":{"column":9,"end_column":28,"end_line":21,"line":21,"path":"scripts/validate-workspace-manifest.py"},"symbol":"cp:TypeRef"},{"attrs":{"name":"print"},"id":"n:typeref:print","kind":"TypeRef","source":{"column":2,"end_column":63,"end_line":25,"line":25,"path":"scripts/validate-workspace-manifest.py"},"symbol":"cp:TypeRef"},{"attrs":{"name":"validate_workspace_manifest"},"id":"n:typeref:validate_workspace_manifest","kind":"TypeRef","source":{"column":2,"end_column":39,"end_line":24,"line":24,"path":"scripts/validate-workspace-manifest.py"},"symbol":"cp:TypeRef"}],"provenance":{"parser":"python-ast","parser_version":"v0","source_path":"scripts/validate-workspace-manifest.py"},"v":"ak.asg.v0"}
