{"authority":"advisory","edges":[{"attrs":{"level":1},"from":"n:module","id":"e:imports:clock","kind":"Imports","symbol":"cp:Imports","to":"n:import:clock"},{"attrs":{"level":1},"from":"n:module","id":"e:imports:frame","kind":"Imports","symbol":"cp:Imports","to":"n:import:frame"},{"attrs":{"level":1},"from":"n:module","id":"e:imports:occurrence","kind":"Imports","symbol":"cp:Imports","to":"n:import:occurrence"},{"attrs":{"level":1},"from":"n:module","id":"e:imports:sid","kind":"Imports","symbol":"cp:Imports","to":"n:import:sid"},{"attrs":{"level":1},"from":"n:module","id":"e:imports:store","kind":"Imports","symbol":"cp:Imports","to":"n:import:store"}],"graph_hash":"sha256:cafb03b3679ce206a237c89b29fc572496ff31c14ebc4bcb8a68a1ce127f5980","language":"python","namespace":"analysis.python.runtime.atomic_kernel.identity.__init__.py","nodes":[{"attrs":{"name":"clock"},"id":"n:import:clock","kind":"Namespace","source":{"column":0,"end_column":106,"end_line":22,"line":22,"path":"runtime/atomic_kernel/identity/__init__.py"},"symbol":"cp:Namespace"},{"attrs":{"name":"frame"},"id":"n:import:frame","kind":"Namespace","source":{"column":0,"end_column":1,"end_line":20,"line":10,"path":"runtime/atomic_kernel/identity/__init__.py"},"symbol":"cp:Namespace"},{"attrs":{"name":"occurrence"},"id":"n:import:occurrence","kind":"Namespace","source":{"column":0,"end_column":1,"end_line":32,"line":23,"path":"runtime/atomic_kernel/identity/__init__.py"},"symbol":"cp:Namespace"},{"attrs":{"name":"sid"},"id":"n:import:sid","kind":"Namespace","source":{"column":0,"end_column":1,"end_line":9,"line":2,"path":"runtime/atomic_kernel/identity/__init__.py"},"symbol":"cp:Namespace"},{"attrs":{"name":"store"},"id":"n:import:store","kind":"Namespace","source":{"column":0,"end_column":58,"end_line":21,"line":21,"path":"runtime/atomic_kernel/identity/__init__.py"},"symbol":"cp:Namespace"},{"attrs":{"name":"runtime/atomic_kernel/identity/__init__.py"},"id":"n:module","kind":"Module","source":{"column":0,"end_column":0,"end_line":1,"line":1,"path":"runtime/atomic_kernel/identity/__init__.py"},"symbol":"cp:Module"}],"provenance":{"parser":"python-ast","parser_version":"v0","source_path":"runtime/atomic_kernel/identity/__init__.py"},"v":"ak.asg.v0"}
