{"authority":"advisory","edges":[{"attrs":{},"from":"n:module","id":"e:calls:KnowledgeGraphMCP:367","kind":"Calls","symbol":"cp:Calls","to":"n:typeref:KnowledgeGraphMCP"},{"attrs":{},"from":"n:module","id":"e:calls:console.error:1133","kind":"Calls","symbol":"cp:Calls","to":"n:typeref:console.error"},{"attrs":{},"from":"n:module","id":"e:calls:console.log:1022","kind":"Calls","symbol":"cp:Calls","to":"n:typeref:console.log"},{"attrs":{},"from":"n:module","id":"e:calls:console.log:215","kind":"Calls","symbol":"cp:Calls","to":"n:typeref:console.log"},{"attrs":{},"from":"n:module","id":"e:calls:console.log:282","kind":"Calls","symbol":"cp:Calls","to":"n:typeref:console.log"},{"attrs":{},"from":"n:module","id":"e:calls:console.log:434","kind":"Calls","symbol":"cp:Calls","to":"n:typeref:console.log"},{"attrs":{},"from":"n:module","id":"e:calls:console.log:665","kind":"Calls","symbol":"cp:Calls","to":"n:typeref:console.log"},{"attrs":{},"from":"n:module","id":"e:calls:console.log:750","kind":"Calls","symbol":"cp:Calls","to":"n:typeref:console.log"},{"attrs":{},"from":"n:module","id":"e:calls:console.log:973","kind":"Calls","symbol":"cp:Calls","to":"n:typeref:console.log"},{"attrs":{},"from":"n:module","id":"e:calls:kg.analyzePathToKnowledgeGraph:519","kind":"Calls","symbol":"cp:Calls","to":"n:typeref:kg.analyzePathToKnowledgeGraph"},{"attrs":{},"from":"n:module","id":"e:calls:kg.analyzePathToKnowledgeGraph:826","kind":"Calls","symbol":"cp:Calls","to":"n:typeref:kg.analyzePathToKnowledgeGraph"},{"attrs":{},"from":"n:module","id":"e:calls:testAnalysisFix:1180","kind":"Calls","symbol":"cp:Calls","to":"n:typeref:testAnalysisFix"},{"attrs":{},"from":"n:module","id":"e:calls:testAnalysisFix:178","kind":"Calls","symbol":"cp:Calls","to":"n:typeref:testAnalysisFix"},{"attrs":{},"from":"n:module","id":"e:imports:../src/mcp/knowledge-graph-mcp:93","kind":"Imports","symbol":"cp:Imports","to":"n:import:../src/mcp/knowledge-graph-mcp"}],"graph_hash":"sha256:63f9cbe970a6f2c61926751e0d6ea55894718ecd4c581f1d1586d9bf250d0cd9","language":"typescript","namespace":"analysis.typescript.packages.hyperbolic-geometric-neural-network.scripts.test-analysis-fix.ts","nodes":[{"attrs":{"name":"../src/mcp/knowledge-graph-mcp"},"id":"n:import:../src/mcp/knowledge-graph-mcp","kind":"Namespace","source":{"column":0,"end_column":67,"end_line":7,"line":6,"path":"packages/hyperbolic-geometric-neural-network/scripts/test-analysis-fix.ts"},"symbol":"cp:Namespace"},{"attrs":{"name":"packages/hyperbolic-geometric-neural-network/scripts/test-analysis-fix.ts"},"id":"n:module","kind":"Module","source":{"column":0,"end_column":0,"end_line":45,"line":1,"path":"packages/hyperbolic-geometric-neural-network/scripts/test-analysis-fix.ts"},"symbol":"cp:Module"},{"attrs":{"name":"KnowledgeGraphMCP"},"id":"n:typeref:KnowledgeGraphMCP","kind":"TypeRef","source":{"column":17,"end_column":35,"end_line":13,"line":13,"path":"packages/hyperbolic-geometric-neural-network/scripts/test-analysis-fix.ts"},"symbol":"cp:TypeRef"},{"attrs":{"name":"console.error"},"id":"n:typeref:console.error","kind":"TypeRef","source":{"column":4,"end_column":18,"end_line":40,"line":40,"path":"packages/hyperbolic-geometric-neural-network/scripts/test-analysis-fix.ts"},"symbol":"cp:TypeRef"},{"attrs":{"name":"console.log"},"id":"n:typeref:console.log","kind":"TypeRef","source":{"column":2,"end_column":14,"end_line":10,"line":10,"path":"packages/hyperbolic-geometric-neural-network/scripts/test-analysis-fix.ts"},"symbol":"cp:TypeRef"},{"attrs":{"name":"kg.analyzePathToKnowledgeGraph"},"id":"n:typeref:kg.analyzePathToKnowledgeGraph","kind":"TypeRef","source":{"column":35,"end_column":66,"end_line":18,"line":18,"path":"packages/hyperbolic-geometric-neural-network/scripts/test-analysis-fix.ts"},"symbol":"cp:TypeRef"},{"attrs":{"name":"testAnalysisFix"},"id":"n:typeref:testAnalysisFix","kind":"TypeRef","source":{"column":15,"end_column":31,"end_line":9,"line":9,"path":"packages/hyperbolic-geometric-neural-network/scripts/test-analysis-fix.ts"},"symbol":"cp:TypeRef"}],"provenance":{"parser":"typescript-regex","parser_version":"v0","source_path":"packages/hyperbolic-geometric-neural-network/scripts/test-analysis-fix.ts"},"v":"ak.asg.v0"}
