{"authority":"advisory","edges":[{"attrs":{},"from":"n:module","id":"e:calls:Account:178","kind":"Calls","symbol":"cp:Calls","to":"n:typeref:Account"},{"attrs":{},"from":"n:module","id":"e:calls:deposit:65","kind":"Calls","symbol":"cp:Calls","to":"n:typeref:deposit"},{"attrs":{},"from":"n:module","id":"e:calls:floor:102","kind":"Calls","symbol":"cp:Calls","to":"n:typeref:floor"},{"attrs":{},"from":"n:module","id":"e:calls:makeAccount:140","kind":"Calls","symbol":"cp:Calls","to":"n:typeref:makeAccount"},{"attrs":{},"from":"n:module","id":"e:defines:class:Account","kind":"Defines","symbol":"cp:Defines","to":"n:class:Account"},{"attrs":{},"from":"n:module","id":"e:defines:function:makeAccount","kind":"Defines","symbol":"cp:Defines","to":"n:function:makeAccount"},{"attrs":{},"from":"n:module","id":"e:defines:method:deposit:63","kind":"Defines","symbol":"cp:Defines","to":"n:method:deposit"},{"attrs":{},"from":"n:class:Account","id":"e:extends:Account:Entity","kind":"Extends","symbol":"cp:Extends","to":"n:typeref:Entity"},{"attrs":{},"from":"n:module","id":"e:imports:mathx:0","kind":"Imports","symbol":"cp:Imports","to":"n:import:mathx"}],"graph_hash":"sha256:56261dfe2d7159bbcf9ec4baa881d5cdc4bc620a38d95c811bee14601f416131","language":"typescript","namespace":"demo.basic-ts","nodes":[{"attrs":{"name":"Account"},"id":"n:class:Account","kind":"Class","source":{"column":0,"end_column":28,"end_line":3,"line":2,"path":"fixtures/asg-ingest/accept/source-basic-ts.ts"},"symbol":"cp:Class"},{"attrs":{"name":"makeAccount"},"id":"n:function:makeAccount","kind":"Function","source":{"column":0,"end_column":28,"end_line":9,"line":8,"path":"fixtures/asg-ingest/accept/source-basic-ts.ts"},"symbol":"cp:Function"},{"attrs":{"name":"mathx"},"id":"n:import:mathx","kind":"Namespace","source":{"column":0,"end_column":30,"end_line":1,"line":1,"path":"fixtures/asg-ingest/accept/source-basic-ts.ts"},"symbol":"cp:Namespace"},{"attrs":{"name":"deposit"},"id":"n:method:deposit","kind":"Method","source":{"column":0,"end_column":27,"end_line":4,"line":4,"path":"fixtures/asg-ingest/accept/source-basic-ts.ts"},"symbol":"cp:Method"},{"attrs":{"name":"fixtures/asg-ingest/accept/source-basic-ts.ts"},"id":"n:module","kind":"Module","source":{"column":0,"end_column":1,"end_line":11,"line":1,"path":"fixtures/asg-ingest/accept/source-basic-ts.ts"},"symbol":"cp:Module"},{"attrs":{"name":"Account"},"id":"n:typeref:Account","kind":"TypeRef","source":{"column":13,"end_column":21,"end_line":10,"line":10,"path":"fixtures/asg-ingest/accept/source-basic-ts.ts"},"symbol":"cp:TypeRef"},{"attrs":{"name":"Entity"},"id":"n:typeref:Entity","kind":"TypeRef","source":{"column":0,"end_column":28,"end_line":3,"line":2,"path":"fixtures/asg-ingest/accept/source-basic-ts.ts"},"symbol":"cp:TypeRef"},{"attrs":{"name":"deposit"},"id":"n:typeref:deposit","kind":"TypeRef","source":{"column":2,"end_column":10,"end_line":4,"line":4,"path":"fixtures/asg-ingest/accept/source-basic-ts.ts"},"symbol":"cp:TypeRef"},{"attrs":{"name":"floor"},"id":"n:typeref:floor","kind":"TypeRef","source":{"column":11,"end_column":17,"end_line":5,"line":5,"path":"fixtures/asg-ingest/accept/source-basic-ts.ts"},"symbol":"cp:TypeRef"},{"attrs":{"name":"makeAccount"},"id":"n:typeref:makeAccount","kind":"TypeRef","source":{"column":16,"end_column":28,"end_line":9,"line":9,"path":"fixtures/asg-ingest/accept/source-basic-ts.ts"},"symbol":"cp:TypeRef"}],"provenance":{"parser":"typescript-regex","parser_version":"v0","source_path":"fixtures/asg-ingest/accept/source-basic-ts.ts"},"v":"ak.asg.v0"}
