{"authority":"advisory","edges":[{"attrs":{},"from":"n:module","id":"e:calls:Date.now:863","kind":"Calls","symbol":"cp:Calls","to":"n:typeref:Date.now"},{"attrs":{},"from":"n:module","id":"e:calls:Date.now:961","kind":"Calls","symbol":"cp:Calls","to":"n:typeref:Date.now"},{"attrs":{},"from":"n:module","id":"e:calls:Error:1030","kind":"Calls","symbol":"cp:Calls","to":"n:typeref:Error"},{"attrs":{},"from":"n:module","id":"e:calls:Promise:1394","kind":"Calls","symbol":"cp:Calls","to":"n:typeref:Promise"},{"attrs":{},"from":"n:module","id":"e:calls:String:2381","kind":"Calls","symbol":"cp:Calls","to":"n:typeref:String"},{"attrs":{},"from":"n:module","id":"e:calls:adapter.getPipelineStatus:1108","kind":"Calls","symbol":"cp:Calls","to":"n:typeref:adapter.getPipelineStatus"},{"attrs":{},"from":"n:module","id":"e:calls:adapter.triggerPipeline:1928","kind":"Calls","symbol":"cp:Calls","to":"n:typeref:adapter.triggerPipeline"},{"attrs":{},"from":"n:module","id":"e:calls:formatPipelineLogs:2195","kind":"Calls","symbol":"cp:Calls","to":"n:typeref:formatPipelineLogs"},{"attrs":{},"from":"n:module","id":"e:calls:isPipelineFailure:2710","kind":"Calls","symbol":"cp:Calls","to":"n:typeref:isPipelineFailure"},{"attrs":{},"from":"n:module","id":"e:calls:isPipelineRunning:2885","kind":"Calls","symbol":"cp:Calls","to":"n:typeref:isPipelineRunning"},{"attrs":{},"from":"n:module","id":"e:calls:isPipelineSuccess:2553","kind":"Calls","symbol":"cp:Calls","to":"n:typeref:isPipelineSuccess"},{"attrs":{},"from":"n:module","id":"e:calls:join:2468","kind":"Calls","symbol":"cp:Calls","to":"n:typeref:join"},{"attrs":{},"from":"n:module","id":"e:calls:line.trim:2348","kind":"Calls","symbol":"cp:Calls","to":"n:typeref:line.trim"},{"attrs":{},"from":"n:module","id":"e:calls:map:2274","kind":"Calls","symbol":"cp:Calls","to":"n:typeref:map"},{"attrs":{},"from":"n:module","id":"e:calls:milliseconds:505","kind":"Calls","symbol":"cp:Calls","to":"n:typeref:milliseconds"},{"attrs":{},"from":"n:module","id":"e:calls:milliseconds:570","kind":"Calls","symbol":"cp:Calls","to":"n:typeref:milliseconds"},{"attrs":{},"from":"n:module","id":"e:calls:padStart:2399","kind":"Calls","symbol":"cp:Calls","to":"n:typeref:padStart"},{"attrs":{},"from":"n:module","id":"e:calls:setTimeout:1413","kind":"Calls","symbol":"cp:Calls","to":"n:typeref:setTimeout"},{"attrs":{},"from":"n:module","id":"e:calls:split:2257","kind":"Calls","symbol":"cp:Calls","to":"n:typeref:split"},{"attrs":{},"from":"n:module","id":"e:calls:triggerAndWait:1685","kind":"Calls","symbol":"cp:Calls","to":"n:typeref:triggerAndWait"},{"attrs":{},"from":"n:module","id":"e:calls:waitForPipeline:1989","kind":"Calls","symbol":"cp:Calls","to":"n:typeref:waitForPipeline"},{"attrs":{},"from":"n:module","id":"e:calls:waitForPipeline:382","kind":"Calls","symbol":"cp:Calls","to":"n:typeref:waitForPipeline"},{"attrs":{},"from":"n:module","id":"e:defines:function:formatPipelineLogs","kind":"Defines","symbol":"cp:Defines","to":"n:function:formatPipelineLogs"},{"attrs":{},"from":"n:module","id":"e:defines:function:isPipelineFailure","kind":"Defines","symbol":"cp:Defines","to":"n:function:isPipelineFailure"},{"attrs":{},"from":"n:module","id":"e:defines:function:isPipelineRunning","kind":"Defines","symbol":"cp:Defines","to":"n:function:isPipelineRunning"},{"attrs":{},"from":"n:module","id":"e:defines:function:isPipelineSuccess","kind":"Defines","symbol":"cp:Defines","to":"n:function:isPipelineSuccess"},{"attrs":{},"from":"n:module","id":"e:imports:./interface:93","kind":"Imports","symbol":"cp:Imports","to":"n:import:./interface"}],"graph_hash":"sha256:3a15e7867bb649be092d0bef20ae35c5228f55f4b4abe0ee5ddbfeba02967e9a","language":"typescript","namespace":"analysis.typescript.src.ci.utils.ts","nodes":[{"attrs":{"name":"formatPipelineLogs"},"id":"n:function:formatPipelineLogs","kind":"Function","source":{"column":0,"end_column":35,"end_line":78,"line":78,"path":"src/ci/utils.ts"},"symbol":"cp:Function"},{"attrs":{"name":"isPipelineFailure"},"id":"n:function:isPipelineFailure","kind":"Function","source":{"column":0,"end_column":34,"end_line":101,"line":101,"path":"src/ci/utils.ts"},"symbol":"cp:Function"},{"attrs":{"name":"isPipelineRunning"},"id":"n:function:isPipelineRunning","kind":"Function","source":{"column":0,"end_column":34,"end_line":108,"line":108,"path":"src/ci/utils.ts"},"symbol":"cp:Function"},{"attrs":{"name":"isPipelineSuccess"},"id":"n:function:isPipelineSuccess","kind":"Function","source":{"column":0,"end_column":34,"end_line":94,"line":94,"path":"src/ci/utils.ts"},"symbol":"cp:Function"},{"attrs":{"name":"./interface"},"id":"n:import:./interface","kind":"Namespace","source":{"column":0,"end_column":77,"end_line":7,"line":6,"path":"src/ci/utils.ts"},"symbol":"cp:Namespace"},{"attrs":{"name":"src/ci/utils.ts"},"id":"n:module","kind":"Module","source":{"column":0,"end_column":1,"end_line":110,"line":1,"path":"src/ci/utils.ts"},"symbol":"cp:Module"},{"attrs":{"name":"Date.now"},"id":"n:typeref:Date.now","kind":"TypeRef","source":{"column":20,"end_column":29,"end_line":31,"line":31,"path":"src/ci/utils.ts"},"symbol":"cp:TypeRef"},{"attrs":{"name":"Error"},"id":"n:typeref:Error","kind":"TypeRef","source":{"column":16,"end_column":22,"end_line":37,"line":37,"path":"src/ci/utils.ts"},"symbol":"cp:TypeRef"},{"attrs":{"name":"Promise"},"id":"n:typeref:Promise","kind":"TypeRef","source":{"column":14,"end_column":22,"end_line":51,"line":51,"path":"src/ci/utils.ts"},"symbol":"cp:TypeRef"},{"attrs":{"name":"String"},"id":"n:typeref:String","kind":"TypeRef","source":{"column":18,"end_column":25,"end_line":84,"line":84,"path":"src/ci/utils.ts"},"symbol":"cp:TypeRef"},{"attrs":{"name":"adapter.getPipelineStatus"},"id":"n:typeref:adapter.getPipelineStatus","kind":"TypeRef","source":{"column":25,"end_column":51,"end_line":40,"line":40,"path":"src/ci/utils.ts"},"symbol":"cp:TypeRef"},{"attrs":{"name":"adapter.triggerPipeline"},"id":"n:typeref:adapter.triggerPipeline","kind":"TypeRef","source":{"column":20,"end_column":44,"end_line":67,"line":67,"path":"src/ci/utils.ts"},"symbol":"cp:TypeRef"},{"attrs":{"name":"formatPipelineLogs"},"id":"n:typeref:formatPipelineLogs","kind":"TypeRef","source":{"column":16,"end_column":35,"end_line":78,"line":78,"path":"src/ci/utils.ts"},"symbol":"cp:TypeRef"},{"attrs":{"name":"isPipelineFailure"},"id":"n:typeref:isPipelineFailure","kind":"TypeRef","source":{"column":16,"end_column":34,"end_line":101,"line":101,"path":"src/ci/utils.ts"},"symbol":"cp:TypeRef"},{"attrs":{"name":"isPipelineRunning"},"id":"n:typeref:isPipelineRunning","kind":"TypeRef","source":{"column":16,"end_column":34,"end_line":108,"line":108,"path":"src/ci/utils.ts"},"symbol":"cp:TypeRef"},{"attrs":{"name":"isPipelineSuccess"},"id":"n:typeref:isPipelineSuccess","kind":"TypeRef","source":{"column":16,"end_column":34,"end_line":94,"line":94,"path":"src/ci/utils.ts"},"symbol":"cp:TypeRef"},{"attrs":{"name":"join"},"id":"n:typeref:join","kind":"TypeRef","source":{"column":5,"end_column":10,"end_line":88,"line":88,"path":"src/ci/utils.ts"},"symbol":"cp:TypeRef"},{"attrs":{"name":"line.trim"},"id":"n:typeref:line.trim","kind":"TypeRef","source":{"column":10,"end_column":20,"end_line":83,"line":83,"path":"src/ci/utils.ts"},"symbol":"cp:TypeRef"},{"attrs":{"name":"map"},"id":"n:typeref:map","kind":"TypeRef","source":{"column":5,"end_column":9,"end_line":81,"line":81,"path":"src/ci/utils.ts"},"symbol":"cp:TypeRef"},{"attrs":{"name":"milliseconds"},"id":"n:typeref:milliseconds","kind":"TypeRef","source":{"column":46,"end_column":60,"end_line":20,"line":20,"path":"src/ci/utils.ts"},"symbol":"cp:TypeRef"},{"attrs":{"name":"padStart"},"id":"n:typeref:padStart","kind":"TypeRef","source":{"column":36,"end_column":45,"end_line":84,"line":84,"path":"src/ci/utils.ts"},"symbol":"cp:TypeRef"},{"attrs":{"name":"setTimeout"},"id":"n:typeref:setTimeout","kind":"TypeRef","source":{"column":33,"end_column":44,"end_line":51,"line":51,"path":"src/ci/utils.ts"},"symbol":"cp:TypeRef"},{"attrs":{"name":"split"},"id":"n:typeref:split","kind":"TypeRef","source":{"column":5,"end_column":11,"end_line":80,"line":80,"path":"src/ci/utils.ts"},"symbol":"cp:TypeRef"},{"attrs":{"name":"triggerAndWait"},"id":"n:typeref:triggerAndWait","kind":"TypeRef","source":{"column":22,"end_column":37,"end_line":62,"line":62,"path":"src/ci/utils.ts"},"symbol":"cp:TypeRef"},{"attrs":{"name":"waitForPipeline"},"id":"n:typeref:waitForPipeline","kind":"TypeRef","source":{"column":22,"end_column":38,"end_line":16,"line":16,"path":"src/ci/utils.ts"},"symbol":"cp:TypeRef"}],"provenance":{"parser":"typescript-regex","parser_version":"v0","source_path":"src/ci/utils.ts"},"v":"ak.asg.v0"}
