{"authority":"advisory","edges":[{"attrs":{},"from":"n:module","id":"e:calls:advancedConsensusExample:316","kind":"Calls","symbol":"cp:Calls","to":"n:typeref:advancedConsensusExample"}],"graph_hash":"sha256:4b047ca94682bba54d3867aa39759c285e3a3df13f04feb3ab021c7a2e5673b5","language":"typescript","namespace":"analysis.typescript.packages.universal-life-intergration.examples.advanced-consensus.d.ts","nodes":[{"attrs":{"name":"packages/universal-life-intergration/examples/advanced-consensus.d.ts"},"id":"n:module","kind":"Module","source":{"column":0,"end_column":47,"end_line":11,"line":1,"path":"packages/universal-life-intergration/examples/advanced-consensus.d.ts"},"symbol":"cp:Module"},{"attrs":{"name":"advancedConsensusExample"},"id":"n:typeref:advancedConsensusExample","kind":"TypeRef","source":{"column":17,"end_column":42,"end_line":9,"line":9,"path":"packages/universal-life-intergration/examples/advanced-consensus.d.ts"},"symbol":"cp:TypeRef"}],"provenance":{"parser":"typescript-regex","parser_version":"v0","source_path":"packages/universal-life-intergration/examples/advanced-consensus.d.ts"},"v":"ak.asg.v0"}
