{"authority":"advisory","edges":[],"graph_hash":"sha256:3287bad1996ffd3aa735422a396cb18f26ed0a64e0661aa8105798dceded8128","language":"python","namespace":"analysis.python.meta-log.services.sensors-api.tests.__init__.py","nodes":[{"attrs":{"name":"meta-log/services/sensors-api/tests/__init__.py"},"id":"n:module","kind":"Module","source":{"column":0,"end_column":0,"end_line":1,"line":1,"path":"meta-log/services/sensors-api/tests/__init__.py"},"symbol":"cp:Module"}],"provenance":{"parser":"python-ast","parser_version":"v0","source_path":"meta-log/services/sensors-api/tests/__init__.py"},"v":"ak.asg.v0"}
