{"authority":"advisory","edges":[{"attrs":{},"from":"n:module","id":"e:calls:createVec:965","kind":"Calls","symbol":"cp:Calls","to":"n:typeref:createVec"},{"attrs":{},"from":"n:module","id":"e:calls:createVertex:908","kind":"Calls","symbol":"cp:Calls","to":"n:typeref:createVertex"},{"attrs":{},"from":"n:module","id":"e:calls:harmonize:854","kind":"Calls","symbol":"cp:Calls","to":"n:typeref:harmonize"},{"attrs":{},"from":"n:module","id":"e:calls:validateBasicAxiom:1400","kind":"Calls","symbol":"cp:Calls","to":"n:typeref:validateBasicAxiom"},{"attrs":{},"from":"n:module","id":"e:calls:vec1:1032","kind":"Calls","symbol":"cp:Calls","to":"n:typeref:vec1"},{"attrs":{},"from":"n:module","id":"e:calls:vec21plus:1295","kind":"Calls","symbol":"cp:Calls","to":"n:typeref:vec21plus"},{"attrs":{},"from":"n:module","id":"e:calls:vec3:1088","kind":"Calls","symbol":"cp:Calls","to":"n:typeref:vec3"},{"attrs":{},"from":"n:module","id":"e:calls:vec5:1154","kind":"Calls","symbol":"cp:Calls","to":"n:typeref:vec5"},{"attrs":{},"from":"n:module","id":"e:calls:vec7:1236","kind":"Calls","symbol":"cp:Calls","to":"n:typeref:vec7"}],"graph_hash":"sha256:e36c98ff25c1061f10382ff28a93784fb571d48f739b32b9590fc812c889e0cd","language":"typescript","namespace":"analysis.typescript.packages.universal-life-hypergraph.src.trie.minimal-types.d.ts","nodes":[{"attrs":{"name":"packages/universal-life-hypergraph/src/trie/minimal-types.d.ts"},"id":"n:module","kind":"Module","source":{"column":0,"end_column":42,"end_line":45,"line":1,"path":"packages/universal-life-hypergraph/src/trie/minimal-types.d.ts"},"symbol":"cp:Module"},{"attrs":{"name":"createVec"},"id":"n:typeref:createVec","kind":"TypeRef","source":{"column":24,"end_column":34,"end_line":36,"line":36,"path":"packages/universal-life-hypergraph/src/trie/minimal-types.d.ts"},"symbol":"cp:TypeRef"},{"attrs":{"name":"createVertex"},"id":"n:typeref:createVertex","kind":"TypeRef","source":{"column":24,"end_column":37,"end_line":35,"line":35,"path":"packages/universal-life-hypergraph/src/trie/minimal-types.d.ts"},"symbol":"cp:TypeRef"},{"attrs":{"name":"harmonize"},"id":"n:typeref:harmonize","kind":"TypeRef","source":{"column":24,"end_column":34,"end_line":34,"line":34,"path":"packages/universal-life-hypergraph/src/trie/minimal-types.d.ts"},"symbol":"cp:TypeRef"},{"attrs":{"name":"validateBasicAxiom"},"id":"n:typeref:validateBasicAxiom","kind":"TypeRef","source":{"column":4,"end_column":23,"end_line":43,"line":43,"path":"packages/universal-life-hypergraph/src/trie/minimal-types.d.ts"},"symbol":"cp:TypeRef"},{"attrs":{"name":"vec1"},"id":"n:typeref:vec1","kind":"TypeRef","source":{"column":24,"end_column":29,"end_line":37,"line":37,"path":"packages/universal-life-hypergraph/src/trie/minimal-types.d.ts"},"symbol":"cp:TypeRef"},{"attrs":{"name":"vec21plus"},"id":"n:typeref:vec21plus","kind":"TypeRef","source":{"column":24,"end_column":34,"end_line":41,"line":41,"path":"packages/universal-life-hypergraph/src/trie/minimal-types.d.ts"},"symbol":"cp:TypeRef"},{"attrs":{"name":"vec3"},"id":"n:typeref:vec3","kind":"TypeRef","source":{"column":24,"end_column":29,"end_line":38,"line":38,"path":"packages/universal-life-hypergraph/src/trie/minimal-types.d.ts"},"symbol":"cp:TypeRef"},{"attrs":{"name":"vec5"},"id":"n:typeref:vec5","kind":"TypeRef","source":{"column":24,"end_column":29,"end_line":39,"line":39,"path":"packages/universal-life-hypergraph/src/trie/minimal-types.d.ts"},"symbol":"cp:TypeRef"},{"attrs":{"name":"vec7"},"id":"n:typeref:vec7","kind":"TypeRef","source":{"column":24,"end_column":29,"end_line":40,"line":40,"path":"packages/universal-life-hypergraph/src/trie/minimal-types.d.ts"},"symbol":"cp:TypeRef"}],"provenance":{"parser":"typescript-regex","parser_version":"v0","source_path":"packages/universal-life-hypergraph/src/trie/minimal-types.d.ts"},"v":"ak.asg.v0"}
