{"authority":"advisory","edges":[{"attrs":{},"from":"n:module","id":"e:calls:FactExtraction.extractFromCanvas:1901","kind":"Calls","symbol":"cp:Calls","to":"n:typeref:FactExtraction.extractFromCanvas"},{"attrs":{},"from":"n:module","id":"e:calls:FixedPoint.compute:1764","kind":"Calls","symbol":"cp:Calls","to":"n:typeref:FixedPoint.compute"},{"attrs":{},"from":"n:module","id":"e:calls:FixedPoint.compute:991","kind":"Calls","symbol":"cp:Calls","to":"n:typeref:FixedPoint.compute"},{"attrs":{},"from":"n:module","id":"e:calls:addFacts:384","kind":"Calls","symbol":"cp:Calls","to":"n:typeref:addFacts"},{"attrs":{},"from":"n:module","id":"e:calls:addRule:498","kind":"Calls","symbol":"cp:Calls","to":"n:typeref:addRule"},{"attrs":{},"from":"n:module","id":"e:calls:allFacts.filter:1134","kind":"Calls","symbol":"cp:Calls","to":"n:typeref:allFacts.filter"},{"attrs":{},"from":"n:module","id":"e:calls:argsStr.split:2220","kind":"Calls","symbol":"cp:Calls","to":"n:typeref:argsStr.split"},{"attrs":{},"from":"n:module","id":"e:calls:arguments:1345","kind":"Calls","symbol":"cp:Calls","to":"n:typeref:arguments"},{"attrs":{},"from":"n:module","id":"e:calls:buildProgram:617","kind":"Calls","symbol":"cp:Calls","to":"n:typeref:buildProgram"},{"attrs":{},"from":"n:module","id":"e:calls:clear:2566","kind":"Calls","symbol":"cp:Calls","to":"n:typeref:clear"},{"attrs":{},"from":"n:module","id":"e:calls:extractFacts:1851","kind":"Calls","symbol":"cp:Calls","to":"n:typeref:extractFacts"},{"attrs":{},"from":"n:module","id":"e:calls:fixedPoint:1707","kind":"Calls","symbol":"cp:Calls","to":"n:typeref:fixedPoint"},{"attrs":{},"from":"n:module","id":"e:calls:getFacts:2384","kind":"Calls","symbol":"cp:Calls","to":"n:typeref:getFacts"},{"attrs":{},"from":"n:module","id":"e:calls:getRules:2471","kind":"Calls","symbol":"cp:Calls","to":"n:typeref:getRules"},{"attrs":{},"from":"n:module","id":"e:calls:goal.match:2077","kind":"Calls","symbol":"cp:Calls","to":"n:typeref:goal.match"},{"attrs":{},"from":"n:module","id":"e:calls:goalArg.startsWith:1490","kind":"Calls","symbol":"cp:Calls","to":"n:typeref:goalArg.startsWith"},{"attrs":{},"from":"n:module","id":"e:calls:map:2239","kind":"Calls","symbol":"cp:Calls","to":"n:typeref:map"},{"attrs":{},"from":"n:module","id":"e:calls:parseGoal:1994","kind":"Calls","symbol":"cp:Calls","to":"n:typeref:parseGoal"},{"attrs":{},"from":"n:module","id":"e:calls:query:793","kind":"Calls","symbol":"cp:Calls","to":"n:typeref:query"},{"attrs":{},"from":"n:module","id":"e:calls:s.trim:2248","kind":"Calls","symbol":"cp:Calls","to":"n:typeref:s.trim"},{"attrs":{},"from":"n:module","id":"e:calls:this.buildProgram:907","kind":"Calls","symbol":"cp:Calls","to":"n:typeref:this.buildProgram"},{"attrs":{},"from":"n:module","id":"e:calls:this.facts.push:420","kind":"Calls","symbol":"cp:Calls","to":"n:typeref:this.facts.push"},{"attrs":{},"from":"n:module","id":"e:calls:this.parseGoal:1086","kind":"Calls","symbol":"cp:Calls","to":"n:typeref:this.parseGoal"},{"attrs":{},"from":"n:module","id":"e:calls:this.rules.push:537","kind":"Calls","symbol":"cp:Calls","to":"n:typeref:this.rules.push"},{"attrs":{},"from":"n:module","id":"e:calls:toString:1542","kind":"Calls","symbol":"cp:Calls","to":"n:typeref:toString"},{"attrs":{},"from":"n:module","id":"e:imports:../types/index.js:0","kind":"Imports","symbol":"cp:Imports","to":"n:import:../types/index.js"},{"attrs":{},"from":"n:module","id":"e:imports:./fact-extraction.js:138","kind":"Imports","symbol":"cp:Imports","to":"n:import:./fact-extraction.js"},{"attrs":{},"from":"n:module","id":"e:imports:./fixed-point.js:91","kind":"Imports","symbol":"cp:Imports","to":"n:import:./fixed-point.js"}],"graph_hash":"sha256:aa594a3e59140dd9427d57a82caa571f633eb896fe80cdae9dfba69db1bc4b95","language":"typescript","namespace":"analysis.typescript.meta-log-db.src.datalog.engine.ts","nodes":[{"attrs":{"name":"../types/index.js"},"id":"n:import:../types/index.js","kind":"Namespace","source":{"column":0,"end_column":90,"end_line":1,"line":1,"path":"meta-log-db/src/datalog/engine.ts"},"symbol":"cp:Namespace"},{"attrs":{"name":"./fact-extraction.js"},"id":"n:import:./fact-extraction.js","kind":"Namespace","source":{"column":0,"end_column":54,"end_line":3,"line":3,"path":"meta-log-db/src/datalog/engine.ts"},"symbol":"cp:Namespace"},{"attrs":{"name":"./fixed-point.js"},"id":"n:import:./fixed-point.js","kind":"Namespace","source":{"column":0,"end_column":46,"end_line":2,"line":2,"path":"meta-log-db/src/datalog/engine.ts"},"symbol":"cp:Namespace"},{"attrs":{"name":"meta-log-db/src/datalog/engine.ts"},"id":"n:module","kind":"Module","source":{"column":0,"end_column":1,"end_line":116,"line":1,"path":"meta-log-db/src/datalog/engine.ts"},"symbol":"cp:Module"},{"attrs":{"name":"FactExtraction.extractFromCanvas"},"id":"n:typeref:FactExtraction.extractFromCanvas","kind":"TypeRef","source":{"column":11,"end_column":44,"end_line":78,"line":78,"path":"meta-log-db/src/datalog/engine.ts"},"symbol":"cp:TypeRef"},{"attrs":{"name":"FixedPoint.compute"},"id":"n:typeref:FixedPoint.compute","kind":"TypeRef","source":{"column":21,"end_column":40,"end_line":43,"line":43,"path":"meta-log-db/src/datalog/engine.ts"},"symbol":"cp:TypeRef"},{"attrs":{"name":"addFacts"},"id":"n:typeref:addFacts","kind":"TypeRef","source":{"column":2,"end_column":11,"end_line":15,"line":15,"path":"meta-log-db/src/datalog/engine.ts"},"symbol":"cp:TypeRef"},{"attrs":{"name":"addRule"},"id":"n:typeref:addRule","kind":"TypeRef","source":{"column":2,"end_column":10,"end_line":22,"line":22,"path":"meta-log-db/src/datalog/engine.ts"},"symbol":"cp:TypeRef"},{"attrs":{"name":"allFacts.filter"},"id":"n:typeref:allFacts.filter","kind":"TypeRef","source":{"column":26,"end_column":42,"end_line":47,"line":47,"path":"meta-log-db/src/datalog/engine.ts"},"symbol":"cp:TypeRef"},{"attrs":{"name":"argsStr.split"},"id":"n:typeref:argsStr.split","kind":"TypeRef","source":{"column":29,"end_column":43,"end_line":89,"line":89,"path":"meta-log-db/src/datalog/engine.ts"},"symbol":"cp:TypeRef"},{"attrs":{"name":"arguments"},"id":"n:typeref:arguments","kind":"TypeRef","source":{"column":15,"end_column":26,"end_line":54,"line":54,"path":"meta-log-db/src/datalog/engine.ts"},"symbol":"cp:TypeRef"},{"attrs":{"name":"buildProgram"},"id":"n:typeref:buildProgram","kind":"TypeRef","source":{"column":2,"end_column":15,"end_line":29,"line":29,"path":"meta-log-db/src/datalog/engine.ts"},"symbol":"cp:TypeRef"},{"attrs":{"name":"clear"},"id":"n:typeref:clear","kind":"TypeRef","source":{"column":2,"end_column":8,"end_line":112,"line":112,"path":"meta-log-db/src/datalog/engine.ts"},"symbol":"cp:TypeRef"},{"attrs":{"name":"extractFacts"},"id":"n:typeref:extractFacts","kind":"TypeRef","source":{"column":2,"end_column":15,"end_line":77,"line":77,"path":"meta-log-db/src/datalog/engine.ts"},"symbol":"cp:TypeRef"},{"attrs":{"name":"fixedPoint"},"id":"n:typeref:fixedPoint","kind":"TypeRef","source":{"column":2,"end_column":13,"end_line":70,"line":70,"path":"meta-log-db/src/datalog/engine.ts"},"symbol":"cp:TypeRef"},{"attrs":{"name":"getFacts"},"id":"n:typeref:getFacts","kind":"TypeRef","source":{"column":2,"end_column":11,"end_line":98,"line":98,"path":"meta-log-db/src/datalog/engine.ts"},"symbol":"cp:TypeRef"},{"attrs":{"name":"getRules"},"id":"n:typeref:getRules","kind":"TypeRef","source":{"column":2,"end_column":11,"end_line":105,"line":105,"path":"meta-log-db/src/datalog/engine.ts"},"symbol":"cp:TypeRef"},{"attrs":{"name":"goal.match"},"id":"n:typeref:goal.match","kind":"TypeRef","source":{"column":18,"end_column":29,"end_line":85,"line":85,"path":"meta-log-db/src/datalog/engine.ts"},"symbol":"cp:TypeRef"},{"attrs":{"name":"goalArg.startsWith"},"id":"n:typeref:goalArg.startsWith","kind":"TypeRef","source":{"column":13,"end_column":32,"end_line":57,"line":57,"path":"meta-log-db/src/datalog/engine.ts"},"symbol":"cp:TypeRef"},{"attrs":{"name":"map"},"id":"n:typeref:map","kind":"TypeRef","source":{"column":48,"end_column":52,"end_line":89,"line":89,"path":"meta-log-db/src/datalog/engine.ts"},"symbol":"cp:TypeRef"},{"attrs":{"name":"parseGoal"},"id":"n:typeref:parseGoal","kind":"TypeRef","source":{"column":10,"end_column":20,"end_line":84,"line":84,"path":"meta-log-db/src/datalog/engine.ts"},"symbol":"cp:TypeRef"},{"attrs":{"name":"query"},"id":"n:typeref:query","kind":"TypeRef","source":{"column":8,"end_column":14,"end_line":39,"line":39,"path":"meta-log-db/src/datalog/engine.ts"},"symbol":"cp:TypeRef"},{"attrs":{"name":"s.trim"},"id":"n:typeref:s.trim","kind":"TypeRef","source":{"column":57,"end_column":64,"end_line":89,"line":89,"path":"meta-log-db/src/datalog/engine.ts"},"symbol":"cp:TypeRef"},{"attrs":{"name":"this.buildProgram"},"id":"n:typeref:this.buildProgram","kind":"TypeRef","source":{"column":37,"end_column":55,"end_line":40,"line":40,"path":"meta-log-db/src/datalog/engine.ts"},"symbol":"cp:TypeRef"},{"attrs":{"name":"this.facts.push"},"id":"n:typeref:this.facts.push","kind":"TypeRef","source":{"column":4,"end_column":20,"end_line":16,"line":16,"path":"meta-log-db/src/datalog/engine.ts"},"symbol":"cp:TypeRef"},{"attrs":{"name":"this.parseGoal"},"id":"n:typeref:this.parseGoal","kind":"TypeRef","source":{"column":23,"end_column":38,"end_line":46,"line":46,"path":"meta-log-db/src/datalog/engine.ts"},"symbol":"cp:TypeRef"},{"attrs":{"name":"this.rules.push"},"id":"n:typeref:this.rules.push","kind":"TypeRef","source":{"column":4,"end_column":20,"end_line":23,"line":23,"path":"meta-log-db/src/datalog/engine.ts"},"symbol":"cp:TypeRef"},{"attrs":{"name":"toString"},"id":"n:typeref:toString","kind":"TypeRef","source":{"column":65,"end_column":74,"end_line":57,"line":57,"path":"meta-log-db/src/datalog/engine.ts"},"symbol":"cp:TypeRef"}],"provenance":{"parser":"typescript-regex","parser_version":"v0","source_path":"meta-log-db/src/datalog/engine.ts"},"v":"ak.asg.v0"}
