{"authority":"advisory","edges":[{"attrs":{},"from":"n:module","id":"e:calls:CommunicationProtocolImpl:382","kind":"Calls","symbol":"cp:Calls","to":"n:typeref:CommunicationProtocolImpl"},{"attrs":{},"from":"n:module","id":"e:calls:create:311","kind":"Calls","symbol":"cp:Calls","to":"n:typeref:create"}],"graph_hash":"sha256:921c706e5565db7508c16511474917f33b631a0f5ca08adefaffb1b1c707acf1","language":"typescript","namespace":"analysis.typescript.packages.autonomous-identity.communication.src.index.ts","nodes":[{"attrs":{"name":"packages/autonomous-identity/communication/src/index.ts"},"id":"n:module","kind":"Module","source":{"column":0,"end_column":2,"end_line":90,"line":1,"path":"packages/autonomous-identity/communication/src/index.ts"},"symbol":"cp:Module"},{"attrs":{"name":"CommunicationProtocolImpl"},"id":"n:typeref:CommunicationProtocolImpl","kind":"TypeRef","source":{"column":15,"end_column":41,"end_line":16,"line":16,"path":"packages/autonomous-identity/communication/src/index.ts"},"symbol":"cp:TypeRef"},{"attrs":{"name":"create"},"id":"n:typeref:create","kind":"TypeRef","source":{"column":9,"end_column":16,"end_line":15,"line":15,"path":"packages/autonomous-identity/communication/src/index.ts"},"symbol":"cp:TypeRef"}],"provenance":{"parser":"typescript-regex","parser_version":"v0","source_path":"packages/autonomous-identity/communication/src/index.ts"},"v":"ak.asg.v0"}
