{"authority":"advisory","edges":[{"attrs":{},"from":"n:module","id":"e:calls:Integration:2143","kind":"Calls","symbol":"cp:Calls","to":"n:typeref:Integration"},{"attrs":{},"from":"n:module","id":"e:calls:async:1178","kind":"Calls","symbol":"cp:Calls","to":"n:typeref:async"},{"attrs":{},"from":"n:module","id":"e:calls:async:415","kind":"Calls","symbol":"cp:Calls","to":"n:typeref:async"},{"attrs":{},"from":"n:module","id":"e:calls:async:777","kind":"Calls","symbol":"cp:Calls","to":"n:typeref:async"},{"attrs":{},"from":"n:module","id":"e:calls:available:528","kind":"Calls","symbol":"cp:Calls","to":"n:typeref:available"},{"attrs":{},"from":"n:module","id":"e:calls:console.log:1065","kind":"Calls","symbol":"cp:Calls","to":"n:typeref:console.log"},{"attrs":{},"from":"n:module","id":"e:calls:console.log:1590","kind":"Calls","symbol":"cp:Calls","to":"n:typeref:console.log"},{"attrs":{},"from":"n:module","id":"e:calls:console.log:2037","kind":"Calls","symbol":"cp:Calls","to":"n:typeref:console.log"},{"attrs":{},"from":"n:module","id":"e:calls:console.log:2337","kind":"Calls","symbol":"cp:Calls","to":"n:typeref:console.log"},{"attrs":{},"from":"n:module","id":"e:calls:console.log:2493","kind":"Calls","symbol":"cp:Calls","to":"n:typeref:console.log"},{"attrs":{},"from":"n:module","id":"e:calls:expect:1385","kind":"Calls","symbol":"cp:Calls","to":"n:typeref:expect"},{"attrs":{},"from":"n:module","id":"e:calls:expect:1549","kind":"Calls","symbol":"cp:Calls","to":"n:typeref:expect"},{"attrs":{},"from":"n:module","id":"e:calls:expect:1961","kind":"Calls","symbol":"cp:Calls","to":"n:typeref:expect"},{"attrs":{},"from":"n:module","id":"e:calls:expect:1994","kind":"Calls","symbol":"cp:Calls","to":"n:typeref:expect"},{"attrs":{},"from":"n:module","id":"e:calls:expect:2434","kind":"Calls","symbol":"cp:Calls","to":"n:typeref:expect"},{"attrs":{},"from":"n:module","id":"e:calls:expect:2548","kind":"Calls","symbol":"cp:Calls","to":"n:typeref:expect"},{"attrs":{},"from":"n:module","id":"e:calls:expect:640","kind":"Calls","symbol":"cp:Calls","to":"n:typeref:expect"},{"attrs":{},"from":"n:module","id":"e:calls:expect:678","kind":"Calls","symbol":"cp:Calls","to":"n:typeref:expect"},{"attrs":{},"from":"n:module","id":"e:calls:expect:831","kind":"Calls","symbol":"cp:Calls","to":"n:typeref:expect"},{"attrs":{},"from":"n:module","id":"e:calls:getCIAgents:1366","kind":"Calls","symbol":"cp:Calls","to":"n:typeref:getCIAgents"},{"attrs":{},"from":"n:module","id":"e:calls:getCIAgents:685","kind":"Calls","symbol":"cp:Calls","to":"n:typeref:getCIAgents"},{"attrs":{},"from":"n:module","id":"e:calls:getCIAgents:812","kind":"Calls","symbol":"cp:Calls","to":"n:typeref:getCIAgents"},{"attrs":{},"from":"n:module","id":"e:calls:getPerformanceMetrics:1509","kind":"Calls","symbol":"cp:Calls","to":"n:typeref:getPerformanceMetrics"},{"attrs":{},"from":"n:module","id":"e:calls:isCIEnabled:2314","kind":"Calls","symbol":"cp:Calls","to":"n:typeref:isCIEnabled"},{"attrs":{},"from":"n:module","id":"e:calls:isCIEnabled:2555","kind":"Calls","symbol":"cp:Calls","to":"n:typeref:isCIEnabled"},{"attrs":{},"from":"n:module","id":"e:calls:isCIEnabled:490","kind":"Calls","symbol":"cp:Calls","to":"n:typeref:isCIEnabled"},{"attrs":{},"from":"n:module","id":"e:calls:isCIEnabled:647","kind":"Calls","symbol":"cp:Calls","to":"n:typeref:isCIEnabled"},{"attrs":{},"from":"n:module","id":"e:calls:not.toBeNull:1402","kind":"Calls","symbol":"cp:Calls","to":"n:typeref:not.toBeNull"},{"attrs":{},"from":"n:module","id":"e:calls:not.toBeNull:1565","kind":"Calls","symbol":"cp:Calls","to":"n:typeref:not.toBeNull"},{"attrs":{},"from":"n:module","id":"e:calls:not.toBeNull:700","kind":"Calls","symbol":"cp:Calls","to":"n:typeref:not.toBeNull"},{"attrs":{},"from":"n:module","id":"e:calls:not.toBeNull:848","kind":"Calls","symbol":"cp:Calls","to":"n:typeref:not.toBeNull"},{"attrs":{},"from":"n:module","id":"e:calls:test.beforeAll:400","kind":"Calls","symbol":"cp:Calls","to":"n:typeref:test.beforeAll"},{"attrs":{},"from":"n:module","id":"e:calls:test.describe:2113","kind":"Calls","symbol":"cp:Calls","to":"n:typeref:test.describe"},{"attrs":{},"from":"n:module","id":"e:calls:test.describe:346","kind":"Calls","symbol":"cp:Calls","to":"n:typeref:test.describe"},{"attrs":{},"from":"n:module","id":"e:calls:test.skip:479","kind":"Calls","symbol":"cp:Calls","to":"n:typeref:test.skip"},{"attrs":{},"from":"n:module","id":"e:calls:test:1131","kind":"Calls","symbol":"cp:Calls","to":"n:typeref:test"},{"attrs":{},"from":"n:module","id":"e:calls:test:1660","kind":"Calls","symbol":"cp:Calls","to":"n:typeref:test"},{"attrs":{},"from":"n:module","id":"e:calls:test:2178","kind":"Calls","symbol":"cp:Calls","to":"n:typeref:test"},{"attrs":{},"from":"n:module","id":"e:calls:test:582","kind":"Calls","symbol":"cp:Calls","to":"n:typeref:test"},{"attrs":{},"from":"n:module","id":"e:calls:test:725","kind":"Calls","symbol":"cp:Calls","to":"n:typeref:test"},{"attrs":{},"from":"n:module","id":"e:calls:toBe:1978","kind":"Calls","symbol":"cp:Calls","to":"n:typeref:toBe"},{"attrs":{},"from":"n:module","id":"e:calls:toBe:2016","kind":"Calls","symbol":"cp:Calls","to":"n:typeref:toBe"},{"attrs":{},"from":"n:module","id":"e:calls:toBe:2447","kind":"Calls","symbol":"cp:Calls","to":"n:typeref:toBe"},{"attrs":{},"from":"n:module","id":"e:calls:toBe:2570","kind":"Calls","symbol":"cp:Calls","to":"n:typeref:toBe"},{"attrs":{},"from":"n:module","id":"e:calls:toBe:662","kind":"Calls","symbol":"cp:Calls","to":"n:typeref:toBe"},{"attrs":{},"from":"n:module","id":"e:imports:./ci-integration:241","kind":"Imports","symbol":"cp:Imports","to":"n:import:./ci-integration"},{"attrs":{},"from":"n:module","id":"e:imports:@playwright/test:191","kind":"Imports","symbol":"cp:Imports","to":"n:import:@playwright/test"}],"graph_hash":"sha256:088757f2e17e30e057a4cca857937b6160c4c0e70eefa98065219ff615750688","language":"typescript","namespace":"analysis.typescript.tests.e2e.ci-workflow.spec.ts","nodes":[{"attrs":{"name":"./ci-integration"},"id":"n:import:./ci-integration","kind":"Namespace","source":{"column":0,"end_column":103,"end_line":9,"line":9,"path":"tests/e2e/ci-workflow.spec.ts"},"symbol":"cp:Namespace"},{"attrs":{"name":"@playwright/test"},"id":"n:import:@playwright/test","kind":"Namespace","source":{"column":0,"end_column":48,"end_line":8,"line":7,"path":"tests/e2e/ci-workflow.spec.ts"},"symbol":"cp:Namespace"},{"attrs":{"name":"tests/e2e/ci-workflow.spec.ts"},"id":"n:module","kind":"Module","source":{"column":0,"end_column":3,"end_line":70,"line":1,"path":"tests/e2e/ci-workflow.spec.ts"},"symbol":"cp:Module"},{"attrs":{"name":"Integration"},"id":"n:typeref:Integration","kind":"TypeRef","source":{"column":30,"end_column":43,"end_line":59,"line":59,"path":"tests/e2e/ci-workflow.spec.ts"},"symbol":"cp:TypeRef"},{"attrs":{"name":"async"},"id":"n:typeref:async","kind":"TypeRef","source":{"column":17,"end_column":24,"end_line":12,"line":12,"path":"tests/e2e/ci-workflow.spec.ts"},"symbol":"cp:TypeRef"},{"attrs":{"name":"available"},"id":"n:typeref:available","kind":"TypeRef","source":{"column":53,"end_column":64,"end_line":14,"line":14,"path":"tests/e2e/ci-workflow.spec.ts"},"symbol":"cp:TypeRef"},{"attrs":{"name":"console.log"},"id":"n:typeref:console.log","kind":"TypeRef","source":{"column":4,"end_column":16,"end_line":30,"line":30,"path":"tests/e2e/ci-workflow.spec.ts"},"symbol":"cp:TypeRef"},{"attrs":{"name":"expect"},"id":"n:typeref:expect","kind":"TypeRef","source":{"column":4,"end_column":11,"end_line":18,"line":18,"path":"tests/e2e/ci-workflow.spec.ts"},"symbol":"cp:TypeRef"},{"attrs":{"name":"getCIAgents"},"id":"n:typeref:getCIAgents","kind":"TypeRef","source":{"column":11,"end_column":23,"end_line":19,"line":19,"path":"tests/e2e/ci-workflow.spec.ts"},"symbol":"cp:TypeRef"},{"attrs":{"name":"getPerformanceMetrics"},"id":"n:typeref:getPerformanceMetrics","kind":"TypeRef","source":{"column":29,"end_column":51,"end_line":41,"line":41,"path":"tests/e2e/ci-workflow.spec.ts"},"symbol":"cp:TypeRef"},{"attrs":{"name":"isCIEnabled"},"id":"n:typeref:isCIEnabled","kind":"TypeRef","source":{"column":15,"end_column":27,"end_line":14,"line":14,"path":"tests/e2e/ci-workflow.spec.ts"},"symbol":"cp:TypeRef"},{"attrs":{"name":"not.toBeNull"},"id":"n:typeref:not.toBeNull","kind":"TypeRef","source":{"column":26,"end_column":39,"end_line":19,"line":19,"path":"tests/e2e/ci-workflow.spec.ts"},"symbol":"cp:TypeRef"},{"attrs":{"name":"test"},"id":"n:typeref:test","kind":"TypeRef","source":{"column":2,"end_column":7,"end_line":17,"line":17,"path":"tests/e2e/ci-workflow.spec.ts"},"symbol":"cp:TypeRef"},{"attrs":{"name":"test.beforeAll"},"id":"n:typeref:test.beforeAll","kind":"TypeRef","source":{"column":2,"end_column":17,"end_line":12,"line":12,"path":"tests/e2e/ci-workflow.spec.ts"},"symbol":"cp:TypeRef"},{"attrs":{"name":"test.describe"},"id":"n:typeref:test.describe","kind":"TypeRef","source":{"column":0,"end_column":14,"end_line":11,"line":11,"path":"tests/e2e/ci-workflow.spec.ts"},"symbol":"cp:TypeRef"},{"attrs":{"name":"test.skip"},"id":"n:typeref:test.skip","kind":"TypeRef","source":{"column":4,"end_column":14,"end_line":14,"line":14,"path":"tests/e2e/ci-workflow.spec.ts"},"symbol":"cp:TypeRef"},{"attrs":{"name":"toBe"},"id":"n:typeref:toBe","kind":"TypeRef","source":{"column":26,"end_column":31,"end_line":18,"line":18,"path":"tests/e2e/ci-workflow.spec.ts"},"symbol":"cp:TypeRef"}],"provenance":{"parser":"typescript-regex","parser_version":"v0","source_path":"tests/e2e/ci-workflow.spec.ts"},"v":"ak.asg.v0"}
