{"authority":"advisory","edges":[],"graph_hash":"sha256:e0bb5f20e48c2a0334acd4a0ea968a10bcb864036738f0df65acd951eca3b369","language":"typescript","namespace":"analysis.typescript.ui.src.components.CodeEditor.types.ts","nodes":[{"attrs":{"name":"ui/src/components/CodeEditor/types.ts"},"id":"n:module","kind":"Module","source":{"column":0,"end_column":0,"end_line":67,"line":1,"path":"ui/src/components/CodeEditor/types.ts"},"symbol":"cp:Module"}],"provenance":{"parser":"typescript-regex","parser_version":"v0","source_path":"ui/src/components/CodeEditor/types.ts"},"v":"ak.asg.v0"}
