{"authority":"advisory","edges":[{"attrs":{"level":0},"from":"n:module","id":"e:imports:__future__","kind":"Imports","symbol":"cp:Imports","to":"n:import:__future__"},{"attrs":{"level":0},"from":"n:module","id":"e:imports:canonical","kind":"Imports","symbol":"cp:Imports","to":"n:import:canonical"},{"attrs":{"level":0},"from":"n:module","id":"e:imports:identity","kind":"Imports","symbol":"cp:Imports","to":"n:import:identity"}],"graph_hash":"sha256:f57c09805fa1162442a71591a230ebed10605138ef9c6714a23e63bd69be288f","language":"python","namespace":"analysis.python.dev-docs.prototype.atomic-kernel.atomic_kernel.identity.py","nodes":[{"attrs":{"name":"__future__"},"id":"n:import:__future__","kind":"Namespace","source":{"column":0,"end_column":34,"end_line":3,"line":3,"path":"dev-docs/prototype/atomic-kernel/atomic_kernel/identity.py"},"symbol":"cp:Namespace"},{"attrs":{"name":"canonical"},"id":"n:import:canonical","kind":"Namespace","source":{"column":0,"end_column":39,"end_line":5,"line":5,"path":"dev-docs/prototype/atomic-kernel/atomic_kernel/identity.py"},"symbol":"cp:Namespace"},{"attrs":{"name":"identity"},"id":"n:import:identity","kind":"Namespace","source":{"column":0,"end_column":40,"end_line":6,"line":6,"path":"dev-docs/prototype/atomic-kernel/atomic_kernel/identity.py"},"symbol":"cp:Namespace"},{"attrs":{"name":"dev-docs/prototype/atomic-kernel/atomic_kernel/identity.py"},"id":"n:module","kind":"Module","source":{"column":0,"end_column":0,"end_line":1,"line":1,"path":"dev-docs/prototype/atomic-kernel/atomic_kernel/identity.py"},"symbol":"cp:Module"}],"provenance":{"parser":"python-ast","parser_version":"v0","source_path":"dev-docs/prototype/atomic-kernel/atomic_kernel/identity.py"},"v":"ak.asg.v0"}
